{
  "name": "path_sanitizer",
  "description": "Sanitizes input paths against directory traversal attacks.",
  "interface": {
    "function": "sanitize_path"
  },
  "requirements": [
    {
      "id": "REQ-001",
      "description": "Strip relative directory traversal sequences (../)."
    },
    {
      "id": "REQ-002",
      "description": "Return safe relative path."
    }
  ]
}