{
  "name": "json_validator",
  "description": "Validates dictionary objects against required field types.",
  "interface": {
    "function": "validate_object"
  },
  "requirements": [
    {
      "id": "REQ-001",
      "description": "Return True for valid schema, False for missing or mistyped keys."
    }
  ]
}