{
  "name": "lru_cache_ttl",
  "description": "Capacity bounded cache with TTL expiration.",
  "interface": {
    "class": "LRUCacheTTL"
  },
  "requirements": [
    {
      "id": "REQ-001",
      "description": "Evict LRU key when capacity exceeded."
    },
    {
      "id": "REQ-002",
      "description": "Expire keys when TTL elapsed."
    }
  ]
}